{
  "$schema": "https://json-schema.org/draft/2020-12/schema",
  "$id": "https://github.com/baristaze/agentic_core/benchmark/schema/browser-session.schema.json",
  "title": "A browser-driven benchmark run",
  "type": "object",
  "required": [
    "run_id",
    "started_at",
    "finished_at",
    "repository_head",
    "prompt",
    "contract",
    "sizes",
    "sessions"
  ],
  "additionalProperties": false,
  "properties": {
    "run_id": {
      "type": "string"
    },
    "started_at": {
      "type": "string",
      "format": "date-time"
    },
    "finished_at": {
      "type": "string",
      "format": "date-time"
    },
    "repository_head": {
      "type": "string",
      "description": "the commit the prompt's repository pointed at when the run started, from git ls-remote, whatever each answer says it read; unknown when the command failed, and note gives the error"
    },
    "prompt": {
      "type": "string",
      "description": "the prompt as it was sent; two runs compare only when this text and the contract are both the same"
    },
    "contract": {
      "type": [
        "string",
        "null"
      ],
      "description": "the text typed after the prompt, in the same message, or null when nothing was; part of what two runs must share to compare"
    },
    "sizes": {
      "type": "object",
      "required": [
        "model",
        "effort"
      ],
      "additionalProperties": false,
      "properties": {
        "model": {
          "enum": [
            "xs",
            "s",
            "m",
            "l",
            "xl"
          ]
        },
        "effort": {
          "enum": [
            "xs",
            "s",
            "m",
            "l",
            "xl"
          ]
        }
      }
    },
    "note": {
      "type": "string",
      "description": "remarks on the run as a whole: the model and effort labels the two sizes resolved to, per site, before anything was sent, and any other"
    },
    "sessions": {
      "type": "array",
      "items": {
        "type": "object",
        "required": [
          "site",
          "url",
          "model_label",
          "effort_label",
          "started_at",
          "finished_at",
          "score",
          "read_version",
          "polls",
          "response_path",
          "status"
        ],
        "additionalProperties": false,
        "properties": {
          "site": {
            "enum": [
              "chatgpt.com",
              "claude.ai",
              "gemini.google.com",
              "grok.com"
            ]
          },
          "url": {
            "type": "string",
            "description": "the conversation's own URL, without its query string; the session id is in it. For not-signed-in and not-run, the address the tab showed, without its query string"
          },
          "model_label": {
            "type": "string",
            "description": "the model picker's checked entry when the prompt was sent, as the list writes it (\"3.1 Pro\", not the chip's \"Pro\"); not set for not-signed-in and not-run"
          },
          "effort_label": {
            "type": "string",
            "description": "the checked effort entry or slider stop label when the prompt was sent, as the picker writes it; none where the site has no effort control; not set for not-signed-in and not-run"
          },
          "started_at": {
            "type": "string",
            "format": "date-time",
            "description": "when the prompt was sent; the moment of recording for not-signed-in and not-run"
          },
          "finished_at": {
            "type": "string",
            "format": "date-time",
            "description": "when the page showed the answer complete; approximate when read off a relative time; the moment of recording for not-signed-in and not-run"
          },
          "score": {
            "type": [
              "integer",
              "null"
            ],
            "minimum": 0,
            "maximum": 100
          },
          "read_version": {
            "type": "string",
            "description": "the commit, tag, or branch and date the answer says it read, in its words; \"not stated\" when it names none or there is no answer"
          },
          "polls": {
            "type": "integer",
            "minimum": 0,
            "maximum": 30,
            "description": "how many times the session was polled; thirty is the bound. A session retried after an error counts the second attempt's polls only, and note gives the first attempt's"
          },
          "response_path": {
            "type": "string",
            "description": "the saved answer, relative to the run folder"
          },
          "status": {
            "enum": [
              "ok",
              "no-score",
              "refused",
              "errored",
              "timed-out",
              "not-signed-in",
              "not-run",
              "smaller-mode"
            ],
            "description": "errored is the product's own error message in place of an answer, on the one retry as on the first attempt; refused is a decline; not-run is a site the skill did not send to, for the reason in note; smaller-mode is a scored answer from a smaller model, mode, or effort than the size asked for, because that one is locked on the account: model_label and effort_label are what ran, note names the locked one, and the session is left out of any like-for-like comparison"
          },
          "note": {
            "type": "string",
            "description": "every remark on the session, in the order they arose, separated by \"; \""
          }
        }
      }
    }
  }
}
