{
  "run_id": "20261012-002612",
  "started_at": "2026-10-12T00:26:12Z",
  "finished_at": "2026-10-12T00:47:25Z",
  "repository_head": "4e90bff8f0b60bc774e0e97bb8a975e09c5fe44a",
  "prompt": "You are a highly senior software engineer and software architect specializing in agentic systems and AI application infrastructure.\n\nEvaluate the `agentic_core` repository at https://github.com/baristaze/agentic_core strictly on its software design and architecture merits. Read the whole repository at its default branch: its specification, `agentic_core_spec.md`, and everything else it holds.\n\nYour goal is not merely to review `agentic_core` in isolation. Your goal is to determine:\n\n1. What architectural problem it is actually solving.\n2. How good its design is for that problem.\n3. Which existing systems are its closest architectural adjacents.\n4. Where `agentic_core` is concretely stronger, weaker, broader, narrower, or simply different.\n5. How all compared systems score under one consistent architectural rubric.\n\nEvaluate the material itself. Do not be biased by who wrote it, an agent or a human, by how fast it was written, or by how new it is.\n\n## Evaluation process\n\nFollow this order deliberately. Do not skip ahead.\n\n### 1. Understand and classify `agentic_core`\n\nFirst, read the repository in full.\n\nDetermine:\n\n- What problem `agentic_core` is trying to solve.\n- Its intended abstraction level.\n- Its architectural role inside an application.\n- Its core execution model.\n- Its primary abstractions.\n- Its intended extension points.\n- What it owns.\n- What it deliberately delegates elsewhere.\n- What it is.\n- Equally importantly, what it is not.\n\nDo not force it into the category of \"agent framework\" if a more precise category describes it better. Name the category you would file it under, in a few words, and say why that name fits better than the obvious ones.\n\nThen identify the closest existing architectural adjacents.\n\nPotential examples include:\n\n- Pydantic AI\n- Claude Agent SDK\n- LangGraph / LangChain\n- OpenAI Agents SDK\n- Temporal or another durable-execution engine, where the overlap is durability rather than the agent loop\n- other systems that are more directly comparable to what `agentic_core` actually provides\n\nThese examples are suggestions, not mandatory choices.\n\nSelect the **2 to 3 most relevant adjacents based on architectural overlap**, not popularity.\n\nFor each selected adjacent, briefly explain why it is a relevant comparison and what portion of `agentic_core` it overlaps with.\n\n### 2. Define and freeze the scoring rubric\n\nBefore scoring anything, define a common architectural evaluation rubric.\n\nThe rubric should fit the category you identified in step 1.\n\nPotential areas include:\n\n- conceptual model and abstraction quality\n- separation of concerns\n- composability and extensibility\n- agent/model/provider independence\n- state and context management\n- orchestration and control-flow model\n- tool/action abstraction\n- streaming and event model\n- observability and debuggability\n- error handling and failure semantics\n- determinism, replayability, and testability\n- concurrency and async model\n- type safety and contract clarity\n- security and isolation boundaries\n- cost and resource accounting\n- framework interoperability and escape hatches\n- operational complexity\n- developer ergonomics\n- architectural coherence and simplicity\n\nModify, combine, remove, or add criteria where appropriate after understanding the actual design.\n\nAvoid excessive fragmentation. Prefer approximately **8 to 12 meaningful architectural criteria** rather than a long checklist of overlapping concerns.\n\nFor each criterion:\n\n1. Give it a concise name.\n2. Define exactly what it measures.\n3. Describe what a `10/10` architecture would look like.\n4. Assign a weight.\n5. Ensure all weights sum to exactly **100**.\n\nOnce defined, **freeze the rubric**.\n\nDo not change criteria, definitions, weights, or scoring interpretation after you start scoring `agentic_core` or its adjacents.\n\n### 3. Evaluate `agentic_core`\n\nScore `agentic_core` against every frozen criterion on a **0 to 10 scale**.\n\nUse the scale consistently:\n\n- `0-2`: fundamentally absent, broken, or architecturally unsuitable\n- `3-4`: significant weaknesses or major missing pieces\n- `5-6`: reasonable but materially incomplete or compromised\n- `7-8`: strong architecture with identifiable limitations\n- `9`: excellent, unusually strong design\n- `10`: exceptional and difficult to improve materially for the intended scope\n\nDo not treat `10` as merely \"supports the feature.\"\n\nFor every score:\n\n- Ground the assessment in concrete design decisions from the repository, and name where each comes from: the file, and the section when it is the specification.\n- Distinguish specified architecture from aspirational language.\n- Identify important ambiguities and underspecified behavior.\n- Do not award points for functionality that is merely implied.\n- Do not penalize intentional narrowness when it improves coherence.\n- Do not penalize the project simply because it is new.\n\nCalculate the weighted result: the sum of each score times its weight, divided by 10, rounded to a whole number.\n\n### 4. Evaluate the selected adjacents\n\nApply the **exact same frozen rubric** to every selected adjacent.\n\nUse their current architecture and primary documentation or source repositories where possible. Name the version or the date of what you read.\n\nEvaluate architectural properties, not ecosystem momentum.\n\nDo **not** use any of the following as scoring criteria:\n\n- age of the project\n- GitHub stars\n- follower count\n- community size\n- market share\n- production adoption\n- company backing\n- version number\n- number of integrations, where that number comes from ecosystem size rather than from the design\n\nWhere an adjacent's architecture is not documented well enough to score a criterion, say so, score only what is documented, and mark that score as low confidence. Never fill a gap with what the system probably does.\n\nCompare like with like. Where an adjacent covers less than `agentic_core` (or more), score each criterion on what each system specifies for it, and say in a line that the scopes differ. Do not reward or penalize scope that the criterion does not measure.\n\nCalculate each adjacent's weighted result the same way.\n\n### 5. Compare\n\nPut every system side by side under the frozen rubric.\n\nThen say, concretely, where `agentic_core` is:\n\n- stronger: a design decision an adjacent lacks, and what it buys;\n- weaker: a decision an adjacent makes better, and what it costs `agentic_core`;\n- broader or narrower: what one owns that the other leaves to the application;\n- simply different: a trade-off where neither side is better, and when each choice wins.\n\nEach point names the design decision behind it, not a feature list.\n\n### 6. Recommend\n\nName the changes to the repository that would raise its score most, most valuable first. Each names the criterion it moves and roughly by how much. Prefer a change that removes or clarifies over one that adds.\n\n## Report format\n\nAnswer in this shape, so evaluations compare:\n\n- First line: `Score: NN/100`, the weighted score of `agentic_core`, and nothing else on that line.\n- `## Classification`: what it is, its abstraction level, what it owns, what it delegates, and what it is not, one line each; then the category you would file it under, in a few words.\n- `## Adjacents`: each selected system, why it was chosen, and the part of `agentic_core` it overlaps, one line each.\n- `## Rubric`: a table of each criterion, what it measures, what a `10/10` looks like, and its weight; the weights sum to 100.\n- `## Scores`: a table with one row per criterion (its weight, then each system's score) and a last row of each system's weighted result out of 100.\n- `## agentic_core, criterion by criterion`: for each criterion, its score and its grounding in the repository, with the ambiguities that held it back, a short paragraph each.\n- `## Where it differs`: stronger, weaker, broader or narrower, and different, one line each.\n- `## What I would change`: concrete edits to the repository, most valuable first, one line each.\n- `## Method`: what you read (the repository's files, with the commit or the date you read them at, and each adjacent's documentation or source with its version or date), how deep, and which scores rest on thin evidence, one line each.",
  "contract": null,
  "sizes": {
    "model": "m",
    "effort": "m"
  },
  "note": "sizes m, m resolved to: chatgpt.com Latest, High; claude.ai Opus 5.5, High; gemini.google.com 3.1 Pro, none; grok.com Expert, none; chatgpt.com's model list names its top entry GPT-6, not Latest; gemini.google.com declined to read the repository, and the run holds no session for it",
  "sessions": [
    {
      "site": "chatgpt.com",
      "url": "[redacted]",
      "model_label": "GPT-6",
      "effort_label": "High",
      "started_at": "2026-10-12T00:27:23Z",
      "finished_at": "2026-10-12T00:36:50Z",
      "score": 83,
      "read_version": "main, accessed October 11, 2026, its changelog at release v0.16.0; no commit named",
      "polls": 3,
      "response_path": "chatgpt.com.md",
      "status": "ok",
      "note": "the page opened in Work mode and was switched to Chat; the model list's top entry reads GPT-6 where sizes.yaml (2026-09-27) names the flagship Latest, and GPT-6 was clicked; the run's tab group closed at about 00:31 while the answer was being written, and the conversation was reopened from its URL"
    },
    {
      "site": "claude.ai",
      "url": "[redacted]",
      "model_label": "Opus 5.5",
      "effort_label": "High",
      "started_at": "2026-10-12T00:28:13Z",
      "finished_at": "2026-10-12T00:46:22Z",
      "score": 77,